{
  "schema_version": "1.0.0",
  "scene_id": "e09-reference-scene",
  "generated_at_utc": "2026-07-13T19:00:00Z",
  "experiment_id": "E09",
  "projection_kind": "abstract",
  "coordinate_system": {
    "frame_id": "e09-abstract-state-space",
    "kind": "cartesian_3d",
    "handedness": "right",
    "abstract_space": true,
    "origin_description": "Dimensionless layout separating node identity and binary metastable state; not measured physical geometry.",
    "axes": {
      "x": {"label": "node separation", "unit": "dimensionless"},
      "y": {"label": "metastable state", "unit": "dimensionless"},
      "z": {"label": "trial ordering", "unit": "dimensionless"}
    }
  },
  "provenance": [
    {
      "id": "completed-abox",
      "uri": "ontology/examples/reference-run.jsonld",
      "sha256": "a241775a48e3866e27378ad2e9cc1ab29a19937fc94077f06f92b233ada028d0",
      "semantic_role": "semantic"
    },
    {
      "id": "event-node-a-000042",
      "uri": "contracts/v1/fixtures/e09-event-000042.json",
      "sha256": "b3bb75b06009d75c3941d0eb1d0773ce7ea1b8cab4818b978f85f62a7bb17a6e",
      "semantic_role": "raw"
    },
    {
      "id": "event-node-b-000042",
      "uri": "contracts/v1/fixtures/e09-event-000042-node-b.json",
      "sha256": "578db54352593f33978e382026d23748447d5494d40f941b579f1613f57c8093",
      "semantic_role": "raw"
    },
    {
      "id": "event-node-b-000043",
      "uri": "contracts/v1/fixtures/e09-event-000043-node-b-invalid.json",
      "sha256": "a53b264d8d10ae87e3f7bc384b0ad5c1dd223c8c1afa982d321ebf1bd1a18768",
      "semantic_role": "raw"
    }
  ],
  "layers": [
    {
      "id": "state-space",
      "label": "Derived state-space layout",
      "scientific_role": "derived",
      "visible_by_default": true
    },
    {
      "id": "event-geometry",
      "label": "Events mapped into derived state space",
      "scientific_role": "derived",
      "visible_by_default": true
    }
  ],
  "entities": [
    {
      "id": "node-a-state-0",
      "layer_id": "state-space",
      "entity_type": "metastable_state",
      "label": "Node A state 0",
      "position": [-1.0, -1.0, 0.0],
      "source_refs": [{
        "artifact_id": "completed-abox",
        "run_id": "reference-seed-7",
        "record_id": "node-a-state-0"
      }],
      "attributes": {"state": 0}
    },
    {
      "id": "node-a-state-1",
      "layer_id": "state-space",
      "entity_type": "metastable_state",
      "label": "Node A state 1",
      "position": [-1.0, 1.0, 0.0],
      "source_refs": [{
        "artifact_id": "completed-abox",
        "run_id": "reference-seed-7",
        "record_id": "node-a-state-1"
      }],
      "attributes": {"state": 1}
    },
    {
      "id": "node-b-state-0",
      "layer_id": "state-space",
      "entity_type": "metastable_state",
      "label": "Node B state 0",
      "position": [1.0, -1.0, 0.0],
      "source_refs": [{
        "artifact_id": "completed-abox",
        "run_id": "reference-seed-7",
        "record_id": "node-b-state-0"
      }],
      "attributes": {"state": 0}
    },
    {
      "id": "node-b-state-1",
      "layer_id": "state-space",
      "entity_type": "metastable_state",
      "label": "Node B state 1",
      "position": [1.0, 1.0, 0.0],
      "source_refs": [{
        "artifact_id": "completed-abox",
        "run_id": "reference-seed-7",
        "record_id": "node-b-state-1"
      }],
      "attributes": {"state": 1}
    }
  ],
  "transitions": [
    {
      "id": "trial-000042-node-a",
      "layer_id": "event-geometry",
      "from_entity_id": "node-a-state-0",
      "to_entity_id": "node-a-state-1",
      "timestamp_utc": "2026-07-13T19:00:01Z",
      "interpolation": "none",
      "observation_role": "measured",
      "geometry_mapping": {
        "scientific_role": "derived",
        "method_id": "e09.abstract-state-space.v1",
        "source_refs": [{
          "artifact_id": "completed-abox",
          "run_id": "reference-seed-7",
          "record_id": "e09-abstract-layout-v1"
        }]
      },
      "trial_id": "trial-000042",
      "correlation_id": "corr-trial-000042",
      "trial_index": 42,
      "node_id": "A",
      "device_id": "reference-node-a",
      "valid": true,
      "exclusion_reasons": [],
      "source_refs": [{
        "artifact_id": "event-node-a-000042",
        "run_id": "reference-seed-7",
        "record_id": "e09-reference-trial-000042-node-a",
        "event_id": "e09-reference-trial-000042-node-a"
      }],
      "attributes": {"commit_time_ns": 1842}
    },
    {
      "id": "trial-000042-node-b",
      "layer_id": "event-geometry",
      "from_entity_id": "node-b-state-0",
      "to_entity_id": "node-b-state-1",
      "timestamp_utc": "2026-07-13T19:00:01.000000071Z",
      "interpolation": "none",
      "observation_role": "measured",
      "geometry_mapping": {
        "scientific_role": "derived",
        "method_id": "e09.abstract-state-space.v1",
        "source_refs": [{
          "artifact_id": "completed-abox",
          "run_id": "reference-seed-7",
          "record_id": "e09-abstract-layout-v1"
        }]
      },
      "trial_id": "trial-000042",
      "correlation_id": "corr-trial-000042",
      "trial_index": 42,
      "node_id": "B",
      "device_id": "reference-node-b",
      "valid": true,
      "exclusion_reasons": [],
      "source_refs": [{
        "artifact_id": "event-node-b-000042",
        "run_id": "reference-seed-7",
        "record_id": "e09-reference-trial-000042-node-b",
        "event_id": "e09-reference-trial-000042-node-b"
      }],
      "uncertainty": {
        "standard_deviation": [0.0, 0.0, 0.008],
        "confidence_level": 0.95
      },
      "attributes": {"commit_time_ns": 1913}
    },
    {
      "id": "trial-000043-node-b-invalid",
      "layer_id": "event-geometry",
      "from_entity_id": "node-b-state-0",
      "to_entity_id": "node-b-state-1",
      "timestamp_utc": "2026-07-13T19:00:02Z",
      "interpolation": "none",
      "observation_role": "measured",
      "geometry_mapping": {
        "scientific_role": "derived",
        "method_id": "e09.abstract-state-space.v1",
        "source_refs": [{
          "artifact_id": "completed-abox",
          "run_id": "reference-seed-7",
          "record_id": "e09-abstract-layout-v1"
        }]
      },
      "trial_id": "trial-000043",
      "correlation_id": "corr-trial-000043",
      "trial_index": 43,
      "node_id": "B",
      "device_id": "reference-node-b",
      "valid": false,
      "exclusion_reasons": ["missing_peer_event"],
      "source_refs": [{
        "artifact_id": "event-node-b-000043",
        "run_id": "reference-seed-7",
        "record_id": "e09-reference-trial-000043-node-b",
        "event_id": "e09-reference-trial-000043-node-b"
      }],
      "uncertainty": {
        "standard_deviation": [0.0, 0.0, 0.011],
        "confidence_level": 0.95
      },
      "attributes": {"commit_time_ns": 2055}
    }
  ]
}
